{
  "id": "river-ruda",
  "country": "PL",
  "jurisdiction": "national",
  "region": "PL",
  "topic": "geography",
  "subtopic": "rivers",
  "title": "Ruda",
  "facts": [
    "Ruda jest rzeką w Polsce; w tym zestawieniu jej odbiornikiem jest Odra.",
    "Rzeka należy do sieci hydrograficznej Polski ujmowanej w państwowych danych o wodach."
  ],
  "effective_from": null,
  "effective_to": null,
  "last_verified": "2026-10-01",
  "official_sources": [
    "https://wody.isok.gov.pl/imap_kzgw/?gpmap=gpSIGW"
  ],
  "related_public_pages": []
}
