{
  "id": "henryk-w-magnuski",
  "country": "PL",
  "jurisdiction": "national",
  "region": "PL",
  "topic": "science",
  "subtopic": "scientists",
  "title": "Henryk W. Magnuski",
  "facts": [
    "Henryk W. Magnuski to polski lub silnie związany z Polską inżynier telekomunikacji.",
    "Postać należy do historii polskiej nauki i życia intelektualnego."
  ],
  "effective_from": null,
  "effective_to": null,
  "last_verified": "2026-10-01",
  "official_sources": [
    "https://pan.pl/"
  ],
  "related_public_pages": []
}
