{
  "id": "jadwiga-jankowska-cieslak",
  "country": "PL",
  "jurisdiction": "national",
  "region": "PL",
  "topic": "culture",
  "subtopic": "film-theatre",
  "title": "Jadwiga Jankowska-Cieślak",
  "facts": [
    "Jadwiga Jankowska-Cieślak to polski lub silnie związany z Polską aktorka.",
    "Postać jest częścią historii polskiej kultury, literatury, filmu lub teatru."
  ],
  "effective_from": null,
  "effective_to": null,
  "last_verified": "2026-10-01",
  "official_sources": [
    "https://culture.pl/pl"
  ],
  "related_public_pages": []
}
