{
  "id": "mariusz-zaruski",
  "country": "PL",
  "jurisdiction": "national",
  "region": "PL",
  "topic": "geography",
  "subtopic": "explorers",
  "title": "Mariusz Zaruski",
  "facts": [
    "Mariusz Zaruski to polski lub silnie związany z Polską żeglarz i taternik.",
    "Postać jest częścią historii polskiej eksploracji, podróży i poznawania świata."
  ],
  "effective_from": null,
  "effective_to": null,
  "last_verified": "2026-10-01",
  "official_sources": [
    "https://www.pgi.gov.pl/"
  ],
  "related_public_pages": []
}
