{
  "id": "jerzy-szczakiel",
  "country": "PL",
  "jurisdiction": "national",
  "region": "PL",
  "topic": "culture",
  "subtopic": "sports-history",
  "title": "Jerzy Szczakiel",
  "facts": [
    "Jerzy Szczakiel to żużlowiec związany z Polską.",
    "Ten temat stanowi część polskiej historii i kultury sportowej."
  ],
  "effective_from": null,
  "effective_to": null,
  "last_verified": "2026-10-01",
  "official_sources": [
    "https://olimpijski.pl/"
  ],
  "related_public_pages": []
}
