{
  "id": "zareczenie-wzajemne-obojga-narodow",
  "country": "PL",
  "jurisdiction": "national",
  "region": "PL",
  "topic": "history",
  "subtopic": "early-modern",
  "title": "Zaręczenie Wzajemne Obojga Narodów",
  "facts": [
    "Zaręczenie Wzajemne Obojga Narodów doprecyzowało zasady unii Polski i Litwy po Konstytucji 3 maja.",
    "Rekord dodano jako odrębny koncept w fazie breadth Hanka Brain."
  ],
  "effective_from": null,
  "effective_to": null,
  "last_verified": "2026-10-01",
  "official_sources": [
    "https://archiwa.gov.pl/o-nas/archiwa-panstwowe/o-archiwach-panstwowych/"
  ],
  "related_public_pages": []
}
