{
  "id": "plebiscyt-na-gornym-slasku",
  "country": "PL",
  "jurisdiction": "national",
  "region": "PL",
  "topic": "history",
  "subtopic": "interwar",
  "title": "Plebiscyt na Górnym Śląsku",
  "facts": [
    "Plebiscyt na Górnym Śląsku — plebiscyt 1921 roku w historii Polski.",
    "Temat pomaga umieścić wydarzenia, postacie i instytucje w szerszej chronologii dziejów Polski."
  ],
  "effective_from": null,
  "effective_to": null,
  "last_verified": "2026-10-01",
  "official_sources": [
    "https://ipn.gov.pl/"
  ],
  "related_public_pages": []
}
