{
  "id": "uniwersytet-ekonomiczny-we-wroclawiu",
  "country": "PL",
  "jurisdiction": "national",
  "region": "PL",
  "topic": "education",
  "subtopic": "universities",
  "title": "Uniwersytet Ekonomiczny we Wrocławiu",
  "facts": [
    "Uniwersytet Ekonomiczny we Wrocławiu to uczelnia wyższa działająca w miejscowości Wrocław.",
    "Uczelnia należy do polskiego systemu szkolnictwa wyższego i nauki."
  ],
  "effective_from": null,
  "effective_to": null,
  "last_verified": "2026-10-01",
  "official_sources": [
    "https://radon.nauka.gov.pl/"
  ],
  "related_public_pages": []
}
