{
  "id": "wifi-vs-cellular",
  "country": "US",
  "jurisdiction": "federal",
  "region": "US",
  "topic": "communications",
  "subtopic": "phone_internet",
  "title": "Wi-Fi a cellular data",
  "facts": [
    "Wi-Fi łączy urządzenie z lokalną siecią bezprzewodową, zwykle poprzez router podłączony do internetu.",
    "Cellular/mobile data korzysta z sieci operatora komórkowego.",
    "Telefon może używać obu technologii, ale limity i opłaty za cellular data wynikają z planu operatora."
  ],
  "effective_from": null,
  "effective_to": null,
  "last_verified": "2026-09-30",
  "official_sources": [
    "https://www.fcc.gov/consumers/guides/getting-broadband"
  ],
  "related_public_pages": []
}
