{
  "id": "heritage-pszczyna-zespol-zamkowo-parkowy",
  "country": "PL",
  "jurisdiction": "national",
  "region": "PL",
  "topic": "heritage",
  "subtopic": "pomniki-historii",
  "title": "Pszczyna – zespół zamkowo-parkowy",
  "facts": [
    "Pszczyna – zespół zamkowo-parkowy znajduje się na liście Pomników Historii Narodowego Instytutu Dziedzictwa.",
    "Pomnik Historii to forma ochrony zabytku nieruchomego o szczególnym znaczeniu dla kultury Polski, ustanawiana rozporządzeniem Prezydenta RP."
  ],
  "effective_from": null,
  "effective_to": null,
  "last_verified": "2026-10-01",
  "official_sources": [
    "https://nid.pl/pomniki-historii/"
  ],
  "related_public_pages": []
}
